{
  "contract_version": "1.0",
  "request_id": "0192b4d6-5d2a-7c4e-9a10-4b2f1e8c7d01",
  "attempt": 1,
  "workflow": { "key": "instagram_photo", "version": "1.0.0" },
  "influencer_id": "0192b4d6-1111-7c4e-9a10-4b2f1e8c7d01",
  "persona": {
    "influencer_id": "0192b4d6-1111-7c4e-9a10-4b2f1e8c7d01",
    "persona_version_id": "0192b4d6-2222-7c4e-9a10-4b2f1e8c7d01",
    "persona_version": 3,
    "identity_package_ref": null,
    "visual_traits": {
      "hair": { "color": "copper", "length": "shoulder", "texture": "wavy" },
      "eyes": "green",
      "age_presentation": "adult, mid-20s"
    },
    "reference_assets": [
      {
        "asset_id": "0192b4d6-3333-7c4e-9a10-4b2f1e8c7d01",
        "role": "face",
        "sha256": "9f2c4b0b6f1f2a1e3c5d7e9f0a1b2c3d4e5f60718293a4b5c6d7e8f90a1b2c3d",
        "mime_type": "image/png",
        "bytes": 1843921,
        "width": 1024,
        "height": 1024,
        "uri": "http://127.0.0.1:8080/v1/assets/0192b4d6-3333-7c4e-9a10-4b2f1e8c7d01/content?exp=1792231200&sig=3b1f…",
        "expires_at": "2026-10-18T13:00:00Z"
      }
    ],
    "adapters": [
      { "adapter_id": "0192b4d6-4444-7c4e-9a10-4b2f1e8c7d01", "kind": "lora", "engine_ref": "persona/luna/identity@3", "weight": 0.85 }
    ]
  },
  "parameters": {
    "environment": "beach at golden hour",
    "outfit": "summer dress",
    "expression": "smiling",
    "aspect_ratio": "4:5"
  },
  "references": [],
  "adapters": [],
  "output": { "count": 4, "transfer": "http_download" },
  "priority": "scheduled_image",
  "timeout_s": 900,
  "deadline_at": "2026-10-19T08:00:00Z",
  "trace": { "trace_id": "4bf92f3577b34da6a3ce929d0e0e4736", "requested_by": "agent:content_strategist/run:0192b4d6-5555-7c4e-9a10-4b2f1e8c7d01" },
  "callback": null
}
