{
  "contract_version": "1.0",
  "request_id": "00000000-0000-4000-8000-00000000c012",
  "attempt": 1,
  "workflow": { "key": "__conformance__.solid_color", "version": "1.0.0" },
  "influencer_id": "00000000-0000-4000-8000-0000000000a1",
  "persona": {
    "influencer_id": "00000000-0000-4000-8000-0000000000a1",
    "persona_version_id": "00000000-0000-4000-8000-0000000000b1",
    "persona_version": 1
  },
  "parameters": { "color": "#cc3366", "width": 32, "height": 32, "delay_ms": 20000 },
  "output": { "count": 1, "transfer": "http_download" },
  "priority": "maintenance",
  "timeout_s": 60
}
